"view_history","rt","trialid","procedure","trial_type","trial_index","time_elapsed","internal_node_id","stimulus","response"
"[{""page_index"":0,""viewing_time"":1426}]","1426","Instructions_01","AIM","instructions","5","5350","0.0-6.0-0.0","",""
"","6012","AIM_001","AIM","survey-multi-choice-vertical","6","11375","0.0-7.0-0.0","{""Q0"":""¿Cuál es el nivel educacional alcanzado (último año aprobado) por el principal sostenedor del hogar?""}","{""Q0"":"" Básica completa; primaria o preparatoria completa.""}"
"","4436","AIM_002","AIM","survey-multi-choice-vertical","7","15824","0.0-8.0-0.0","{""Q0"":""¿Cuál de las siguientes ocupaciones corresponde al trabajo del principal sostenedor del hogar? [Si el principal sostenedor del hogar está cesante o es jubilado, debe ser la última ocupación remunerada que tuvo. Si el principal sostenedor tiene más de 1 trabajo, debe registrarse el de mayor ingreso.]""}","{""Q0"":"" Trabajadores de los servicios y vendedores de comercio y mercados.""}"
"","1383","AIM_003","AIM","survey-text","8","17215","0.0-9.0-0.0","{""Q0"":""Ahora, hablando de su hogar: Incluyéndose usted, ¿cuántas personas viven en su hogar en la actualidad? No considere el servicio doméstico, aunque sea puertas adentro.""}","{""Q0"":""30""}"
"","3172","AIM_010","AIM","survey-multi-choice-vertical","9","20398","0.0-16.0-0.0-0.0","{""Q0"":""Por favor, piense en ingreso total de su hogar en un mes promedio, considerando el aporte de todos sus miembros y otros ingresos adicionales como rentas de propiedades, jubilaciones o pensiones. ¿en cuál de estos tramos está el ingreso total mensual de su hogar?""}","{""Q0"":"" 464 mil – 808 mil""}"
